{
  "spec_version": "1.0",
  "enrollment_session_id": "01HZX8K2P4M6N9R3T5V7W1Y2Z6",
  "enrollment_token_hash": "9f86d081884c7d659a2feaa0c55ad015a3bf4f1b2b0b822cd15d6c15b0f00a08",
  "principal_did": "did:aria:aria.bar:u-cmDoHhM3:org",
  "agent_name": "ordering-agent",
  "trust_level": "L1",
  "target_domain": "ordering-bot.acme.example",
  "external_did": "did:web:ordering-bot.acme.example",
  "external_did_proof": {
    "type": "Ed25519Signature2020",
    "challenge": "4a8b1c2d3e4f5061718293a4b5c6d7e8f9012345678901abcdef234567890ab1",
    "signature": "zBiFnKrPvTzX4b8fCjGoLsQwU1Y5c9gDkHpMtRxV2Z6dAhEmJqNuSyW3a7eBiFnKrPvTzX4b8fCjGoLsQwU1Y5c9"
  },
  "selected_scopes": [
    "commerce:catalog:read",
    "commerce:order:create"
  ],
  "hitl_required": [
    "commerce:order:create"
  ],
  "holder_public_key": {
    "suite": "mldsa65-ed25519-2026",
    "ed25519_multibase": "z6MkpTHR8VNsBxYAAWHut2Geadd9jSwuBV8xRoAnwWsdvktH",
    "mldsa65_multibase": "zJqNuSyW3a7eBiFnKrPvTzX4b8fCjGoLsQwU1Y5c9gDkHpMtRxV2Z6dAhEmJqNuSyW3a7eBiFnKrPvTzX4b8fCjGoLsQwU1Y5c9gDkHpMtRxV2Z6dAhEmJqNuSyW3a7eBiFnKrPvTzX4b8fCjGoLsQwU1Y5c9gDkHpMtRxV2Z6dAhEmJqNuSyW3a7eBiFnKrPvTzX4b8fCjGoLsQwU1Y5c9gDkHpMtRxV2Z6dAhEmJqNuSyW3a7eBiFnKrPvTzX4b8fCjGoLsQwU1Y5c9gDkHpMtRxV2Z6dAhEmJqNuSyW3a7eBiFnKrPvTzX4b8fCjGoLsQwU1Y5c9gDkHpMtRxV2Z6dAhEmJqNuSyW3a7eBiFnKrPvTzX4b8fCjGoLsQwU1Y5c9gDkHpMtRxV2Z6dAhEmJqNuSyW3a7eBiFnKrPvTzX4b8fCjGoLsQwU1Y5c9gDkHpMtRxV2Z6dAhEmJqNuSyW3a7eBiFnKrPvTzX4b8fCjGoLsQwU1Y5c9gDkHpMtRxV2Z6dAhEmJqNuSyW3a7eBiFnKrPvTzX4b8fCjGoLsQwU1Y5c9gDkHpMtRxV2Z6dAhEmJqNuSyW3a7eBiFnKrPvTzX4b8fCjGoLsQwU1Y5c9gDkHpMtRxV2Z6dAhEmJqNuSyW3a7eBiFnKrPvTzX4b8fCjGoLsQwU1Y5c9gDkHpMtRxV2Z6dAhEmJqNuSyW3a7eBiFnKrPvTzX4b8fCjGoLsQwU1Y5c9gDkHpMtRxV2Z6dAhEmJqNuSyW3a7eBiFnKrPvTzX4b8fCjGoLsQwU1Y5c9gDkHpMtRxV2Z6dAhEmJqNuSyW3a7eBiFnKrPvTzX4b8fCjGoLsQwU1Y5c9gDkHpMtRxV2Z6dAhEmJqNuSyW3a7eBiFnKrPvTzX4b8fCjGoLsQwU1Y5c9gDkHpMtRxV2Z6dAhEmJqNuSyW3a7eBiFnKrPvTzX4b8fCjGoLsQwU1Y5c9gDkHpMtRxV2Z6dAhEmJqNuSyW3a7eBiFnKrPvTzX4b8fCjGoLsQwU1Y5c9gDkHpMtRxV2Z6dAhEmJqNuSyW3a7eBiFnKrPvTzX4b8fCjGoLsQwU1Y5c9gDkHpMtRxV2Z6dAhEmJqNuSyW3a7eBiFnKrPvTzX4b8fCjGoLsQwU1Y5c9gDkHpMtRxV2Z6dAhEmJqNuSyW3a7eBiFnKrPvTzX4b8fCjGoLsQwU1Y5c9gDkHpMtRxV2Z6dAhEmJqNuSyW3a7eBiFnKrPvTzX4b8fCjGoLsQwU1Y5c9gDkHpMtRxV2Z6dAhEmJqNuSyW3a7eBiFnKrPvTzX4b8fCjGoLsQwU1Y5c9gDkHpMtRxV2Z6dAhEmJqNuSyW3a7eBiFnKrPvTzX4b8fCjGoLsQwU1Y5c9gDkHpMtRxV2Z6dAhEmJqNuSyW3a7eBiFnKrPvTzX4b8fCjGoLsQwU1Y5c9gDkHpMtRxV2Z6dAhEmJqNuSyW3a7eBiFnKrPvTzX4b8fCjGoLsQwU1Y5c9gDkHpMtRxV2Z6dAhEmJqNuSyW3a7eBiFnKrPvTzX4b8fCjGoLsQwU1Y5c9gDkHpMtRxV2Z6dAhEmJqNuSyW3a7eBiFnKrPvTzX4b8fCjGoLsQwU1Y5c9gDkHpMtRxV2Z6dAhEmJqNuSyW3a7eBiFnKrPvTzX4b8fCjGoLsQwU1Y5c9gDkHpMtRxV2Z6dAhEmJqNuSyW3a7eBiFnKrPvTzX4b8fCjGoLsQwU1Y5c9gDkHpMtRxV2Z6dAhEmJqNuSyW3a7eBiFnKrPvTzX4b8fCjGoLsQwU1Y5c9gDkHpMtRxV2Z6dAhEmJqNuSyW3a7eBiFnKrPvTzX4b8fCjGoLsQwU1Y5c9gDkHpMtRxV2Z6dAhEmJqNuSyW3a7eBiFnKrPvTzX4b8fCjGoLsQwU1Y5c9gDkHpMtRxV2Z6dAhEmJqNuSyW3a7eBiFnKrPvTzX4b8fCjGoLsQwU1Y5c9gDkHpMtRxV2Z6dAhEmJqNuSyW3a7eBiFnKrPvTzX4b8fCjGoLsQwU1Y5c9gDkHpMtRxV2Z6dAhEmJqNuSyW3a7eBiFnKrPvTzX4b8fCjGoLsQwU1Y5c9gDkHpMtRxV2Z6dAhEmJqNuSyW3a7eBiFnKrPvTzX4b8fCjGoLsQwU1Y5c9gDkHpMtRxV2Z6dAhEmJqNuSyW3a7eBiFnKrPvTzX4b8fCjGoLsQwU1Y5c9gDkHpMtRxV2Z6dAhEmJqNuSyW3a7eBiFnKrPvTzX4b8fCjGoLsQwU1Y5c9gDkHpMtRxV2Z6dAhEmJqNuSyW3a7eBiFnKrPvTzX4b8fCjGoLsQwU1Y5c9gDkHpMtRxV2Z6dAhEmJqNuSyW3a7eBiFnKrPvTzX4b8fCjGoLsQwU1Y5c9gDkHpMtRxV2Z6dAhEmJqNuSyW3a7eBiFnKrPvTzX4b8fCjGoLsQwU1Y5c9gDkHpMtRxV2Z6dAhEmJqNuSyW3a7eBiFnKrPvTzX4b8fCjGoLsQwU1Y5c9gDkHpMtRxV2Z6dAhEmJqNuSyW3a7eBiFnKrPvTzX4b8fCjGoLsQwU1Y5c9gDkHpMtRxV2Z6dAhEmJqNuSyW3a7eBiFnKrPvTzX4b8fCjGoLsQwU1Y5c9gDkHpMtRxV2Z6dAhEmJqNuSyW3a7eBiFnKrPvTzX4b8fCjGoLsQwU1Y5c9gDkH"
  },
  "sdk_attestation": {
    "name": "@aria-registry/sdk-node",
    "version": "1.2.0",
    "platform": "node"
  },
  "environment": {
    "runtime": "node",
    "runtime_version": "v22.16.0",
    "region_hint": "aws:us-east-1"
  },
  "created_at": "2026-05-12T23:54:01.118Z",
  "identity_commitment": "1c4a5e8f902b3d4c5e6f7081929a3b4c5d6e7f808192a3b4c5d6e7f80a1b2c3d",
  "self_signature": {
    "suite": "mldsa65-ed25519-2026",
    "ed25519": "iBg_e9c7a5Y3W1UzSxQvOtMrKpInGlEjChAf-d8b6Z4X2V0TyRwPuNsLqJoHmFkDiBg_e9c7a5Y3W1UzSxQvOt",
    "mldsa65": "zSxQvOtMrKpInGlEjChAf-d8b6Z4X2V0TyRwPuNsLqJoHmFkDiBg_e9c7a5Y3W1UzSxQvOtMrKpInGlEjChAf-d8b6Z4X2V0TyRwPuNsLqJoHmFkDiBg_e9c7a5Y3W1UzSxQvOtMrKpInGlEjChAf-d8b6Z4X2V0TyRwPuNsLqJoHmFkDiBg_e9c7a5Y3W1UzSxQvOtMrKpInGlEjChAf-d8b6Z4X2V0TyRwPuNsLqJoHmFkDiBg_e9c7a5Y3W1UzSxQvOtMrKpInGlEjChAf-d8b6Z4X2V0TyRwPuNsLqJoHmFkDiBg_e9c7a5Y3W1UzSxQvOtMrKpInGlEjChAf-d8b6Z4X2V0TyRwPuNsLqJoHmFkDiBg_e9c7a5Y3W1UzSxQvOtMrKpInGlEjChAf-d8b6Z4X2V0TyRwPuNsLqJoHmFkDiBg_e9c7a5Y3W1UzSxQvOtMrKpInGlEjChAf-d8b6Z4X2V0TyRwPuNsLqJoHmFkDiBg_e9c7a5Y3W1UzSxQvOtMrKpInGlEjChAf-d8b6Z4X2V0TyRwPuNsLqJoHmFkDiBg_e9c7a5Y3W1UzSxQvOtMrKpInGlEjChAf-d8b6Z4X2V0TyRwPuNsLqJoHmFkDiBg_e9c7a5Y3W1UzSxQvOtMrKpInGlEjChAf-d8b6Z4X2V0TyRwPuNsLqJoHmFkDiBg_e9c7a5Y3W1UzSxQvOtMrKpInGlEjChAf-d8b6Z4X2V0TyRwPuNsLqJoHmFkDiBg_e9c7a5Y3W1UzSxQvOtMrKpInGlEjChAf-d8b6Z4X2V0TyRwPuNsLqJoHmFkDiBg_e9c7a5Y3W1UzSxQvOtMrKpInGlEjChAf-d8b6Z4X2V0TyRwPuNsLqJoHmFkDiBg_e9c7a5Y3W1UzSxQvOtMrKpInGlEjChAf-d8b6Z4X2V0TyRwPuNsLqJoHmFkDiBg_e9c7a5Y3W1UzSxQvOtMrKpInGlEjChAf-d8b6Z4X2V0TyRwPuNsLqJoHmFkDiBg_e9c7a5Y3W1UzSxQvOtMrKpInGlEjChAf-d8b6Z4X2V0TyRwPuNsLqJoHmFkDiBg_e9c7a5Y3W1UzSxQvOtMrKpInGlEjChAf-d8b6Z4X2V0TyRwPuNsLqJoHmFkDiBg_e9c7a5Y3W1UzSxQvOtMrKpInGlEjChAf-d8b6Z4X2V0TyRwPuNsLqJoHmFkDiBg_e9c7a5Y3W1UzSxQvOtMrKpInGlEjChAf-d8b6Z4X2V0TyRwPuNsLqJoHmFkDiBg_e9c7a5Y3W1UzSxQvOtMrKpInGlEjChAf-d8b6Z4X2V0TyRwPuNsLqJoHmFkDiBg_e9c7a5Y3W1UzSxQvOtMrKpInGlEjChAf-d8b6Z4X2V0TyRwPuNsLqJoHmFkDiBg_e9c7a5Y3W1UzSxQvOtMrKpInGlEjChAf-d8b6Z4X2V0TyRwPuNsLqJoHmFkDiBg_e9c7a5Y3W1UzSxQvOtMrKpInGlEjChAf-d8b6Z4X2V0TyRwPuNsLqJoHmFkDiBg_e9c7a5Y3W1UzSxQvOtMrKpInGlEjChAf-d8b6Z4X2V0TyRwPuNsLqJoHmFkDiBg_e9c7a5Y3W1UzSxQvOtMrKpInGlEjChAf-d8b6Z4X2V0TyRwPuNsLqJoHmFkDiBg_e9c7a5Y3W1UzSxQvOtMrKpInGlEjChAf-d8b6Z4X2V0TyRwPuNsLqJoHmFkDiBg_e9c7a5Y3W1UzSxQvOtMrKpInGlEjChAf-d8b6Z4X2V0TyRwPuNsLqJoHmFkDiBg_e9c7a5Y3W1UzSxQvOtMrKpInGlEjChAf-d8b6Z4X2V0TyRwPuNsLqJoHmFkDiBg_e9c7a5Y3W1UzSxQvOtMrKpInGlEjChAf-d8b6Z4X2V0TyRwPuNsLqJoHmFkDiBg_e9c7a5Y3W1UzSxQvOtMrKpInGlEjChAf-d8b6Z4X2V0TyRwPuNsLqJoHmFkDiBg_e9c7a5Y3W1UzSxQvOtMrKpInGlEjChAf-d8b6Z4X2V0TyRwPuNsLqJoHmFkDiBg_e9c7a5Y3W1UzSxQvOtMrKpInGlEjChAf-d8b6Z4X2V0TyRwPuNsLqJoHmFkDiBg_e9c7a5Y3W1UzSxQvOtMrKpInGlEjChAf-d8b6Z4X2V0TyRwPuNsLqJoHmFkDiBg_e9c7a5Y3W1UzSxQvOtMrKpInGlEjChAf-d8b6Z4X2V0TyRwPuNsLqJoHmFkDiBg_e9c7a5Y3W1UzSxQvOtMrKpInGlEjChAf-d8b6Z4X2V0TyRwPuNsLqJoHmFkDiBg_e9c7a5Y3W1UzSxQvOtMrKpInGlEjChAf-d8b6Z4X2V0TyRwPuNsLqJoHmFkDiBg_e9c7a5Y3W1UzSxQvOtMrKpInGlEjChAf-d8b6Z4X2V0TyRwPuNsLqJoHmFkDiBg_e9c7a5Y3W1UzSxQvOtMrKpInGlEjChAf-d8b6Z4X2V0TyRwPuNsLqJoHmFkDiBg_e9c7a5Y3W1UzSxQvOtMrKpInGlEjChAf-d8b6Z4X2V0TyRwPuNsLqJoHmFkDiBg_e9c7a5Y3W1UzSxQvOtMrKpInGlEjChAf-d8b6Z4X2V0TyRwPuNsLqJoHmFkDiBg_e9c7a5Y3W1UzSxQvOtMrKpInGlEjChAf-d8b6Z4X2V0TyRwPuNsLqJoHmFkDiBg_e9c7a5Y3W1UzSxQvOtMrKpInGlEjChAf-d8b6Z4X2V0TyRwPuNsLqJoHmFkDiBg_e9c7a5Y3W1UzSxQvOtMrKpInGlEjChAf-d8b6Z4X2V0TyRwPuNsLqJoHmFkDiBg_e9c7a5Y3W1UzSxQvOtMrKpInGlEjChAf-d8b6Z4X2V0TyRwPuNsLqJoHmFkDiBg_e9c7a5Y3W1UzSxQvOtMrKpInGlEjChAf-d8b6Z4X2V0TyRwPuNsLqJoHmFkDiBg_e9c7a5Y3W1UzSxQvOtMrKpInGlEjChAf-d8b6Z4X2V0TyRwPuNsLqJoHmFkDiBg_e9c7a5Y3W1UzSxQvOtMrKpInGlEjChAf-d8b6Z4X2V0TyRwPuNsLqJoHmFkDiBg_e9c7a5Y3W1UzSxQvOtMrKpInGlEjChAf-d8b6Z4X2V0TyRwPuNsLqJoHmFkDiBg_e9c7a5Y3W1UzSxQvOtMrKpInGlEjChAf-d8b6Z4X2V0TyRwPuNsLqJoHmFkDiBg_e9c7a5Y3W1UzSxQvOtMrKpInGlEjChAf-d8b6Z4X2V0TyRwPuNsLqJoHmFkDiBg_e9c7a5Y3W1UzSxQvOtMrKpInGlEjChAf-d8b6Z4X2V0TyRwPuNsLqJoHmFkDiBg_e9c7a5Y3W1UzSxQvOtMrKpInGlEjChAf-d8b6Z4X2V0TyRwPuNsLqJoHmFkDiBg_e9c7a5Y3W1UzSxQvOtMrKpInGlEjChAf-d8b6Z4X2V0TyRwPuNsLqJoHmFkDiBg_e9c7a5Y3W1UzSxQvOtMrKpInGlEjChAf-d8b6Z4X2V0TyRwPuNsLqJoHmFkDiBg_e9c7a5Y3W1UzSxQvOtMrKpInGlEjChAf-d8b6Z4X2V0TyRwPuNsLqJoHmFkDiBg_e9c7a5Y3W1UzSxQvOtMrKpInGlEjChAf-d8b6Z4X2V0TyRwPuNsLqJoHmFkDiBg_e9c7a5Y3W1UzSxQvOtMrKpInGlEjChAf-d8b6Z4X2V0TyRwPuNsLqJoHmFkDiBg_e9c7a5Y3W1UzSxQvOtMrKpInGlEjChAf-d8b6Z4X2V0TyRwPuNsLqJoHmFkDiBg_e9c7a5Y3W1UzSxQvOtMrKpInGlEjChAf-d8b6Z4X2V0TyRwPuNsLqJoHmFkDiBg_e9c7a5Y3W1UzSxQvOtMrKpInGlEjChAf-d8b6Z4X2V0TyRwPuNsLqJoHmFkDiBg_e9c7a5Y3W1UzSxQvOtMrKpInGlEjChAf-d8b6Z4X2V0TyRwPuNsLqJoHmFkDiBg_e9c7a5Y3W1UzSxQvOtMrKpInGlEjChAf-d8b6Z4X2V0TyRwPuNsLqJoHmFkDiBg_e9c7a5Y3W1UzSxQvOtMrKpInGlEjChAf-d8b6Z4X2V0TyRwPuNsLqJoHmFkDiBg_e9c7a5Y3W1UzSxQvOtMrKpInGlEjChAf-d8b6Z4X2V0TyRwPuNsLqJoHmFkDiBg_e9c7a5Y3W1UzSxQvOtMrKpInGlEjChAf-d8b6Z4X2V0TyRwPuNsLqJoHmFkDiBg_e9c7a5Y3W1UzSxQvOtMrKpInGlEjChAf-d8b6Z4X2V0TyRwPuNsLqJoHmFkDiBg_e9c7a5Y3W1UzSxQvOtMrKpInGlEjChAf-d8b6Z4X2V0TyRwPuNsLqJoHmFkDiBg_e9c7a5Y3W1UzSxQvOtMrKpInGlEjChAf-d8b6Z4X2V0TyRwPuNs"
  }
}
